{
  "schemaVersion": 1,
  "intentId": "intent-conformance-1",
  "strategyRunId": "run-conformance-1",
  "stateVersion": "7",
  "variant": "jitosol_carry",
  "operation": "REBALANCE",
  "leg": "PERP",
  "instrument": "SOL-PERP",
  "side": "SELL",
  "maxQuantityAtoms": "38271565",
  "limitPriceAtoms": "149980000",
  "maxSlippageBps": "50",
  "reduceOnly": false,
  "expiresAtMs": "1785024005000",
  "policyProfile": "shadow-v1",
  "snapshotIds": ["snapshot-1"],
  "configHash": "0000000000000000000000000000000000000000000000000000000000000000"
}
